{
  "protocol_version": "cpo-contracts@0.1.0",
  "exception_id": "X-EXAMPLE-001",
  "policy_check_id": "GATE-DECISION-COMPLETENESS",
  "scope": {
    "action_type": "CREATE_DECISION",
    "decision_id": "D-EXAMPLE-001"
  },
  "expiry_at": "2026-02-01T00:00:00Z",
  "justification": "Temporary migration; will backfill success criteria.",
  "approved_by": "user:governance",
  "created_at": "2026-01-25T12:00:00+00:00",
  "created_by": "user:example"
}